annotation,concept,label
"«Крейцерова соната» — самое скандальное произведение Толстого. На страницах повести писатель излагает свои поздние взгляды на взаимоотношения полов. «Смерть Ивана Ильича» — одна из вершин мировой психологической прозы: хроника смертельной болезни, где умирающий отказывается принять смерть и приходит к пониманию того, чем была его жизнь. «Хаджи-Мурат» — размышления позднего Толстого о жизнестойкости и о развращающей силе власти. Последняя большая художественная вещь и в каком-то смысле завещание Толстого.",характер,0
"В книге представлены наиболее известные пьесы Д.И. Фонвизина – «Недоросль» и «Бригадир». Комедии, написанные в далеком «веке золотом Екатерины», – вот истинный показатель таланта автора – не утрачивают актуальности и в наши дни. Ведь выведенные в них типажи богатеньких сынков, неучей, невеж и самодуров встречаются нам и сегодня, а легендарные «Не хочу учиться – хочу жениться» или «Век живи – век учись» знает каждый.",война,0
Идея построения «общепролетарского дома» превращает «Котлован» в мощную антиутопию: утопический «земной рай» оборачивается кладбищем несбыточных фантазий и личной мировоззренческой трагедией.,власть,1
"\Анну Каренину по праву называют самым известным и популярным в мире романом о любви. \Огромная разработка души человеческой, как отзывался о книге Достоевский, — вот, наверное, что больше всего подкупает нас в этой книге. История всепоглощающей страсти, история замужней женщины, полюбившей красавца офицера и бросившей своего мужа наперекор всему: мнению света, общепринятой морали, своей совести. \Анну Каренину экранизировали 30 раз, музыку к балету писали Чайковский и Родион Щедрин, главную героиню в кино играли Грета Гарбо и Вивьен Ли, Алла Тарасова и Татьяна Самойлова, Софи Марсо и Кира Найтли. Эта книга, конечно, гораздо больше, чем просто роман о любви, это целая наука о семье, об обществе и о жизни.",любовь,1
"История мальчиков, оказавшихся на необитаемом острове, превращается в философскую притчу о распаде цивилизации и природе человеческого зла.",гражданская_война,0
"Тэффи считала сборник «Ведьма», вышедший в 1936 году, самой удачной своей книгой. На его страницах оживают ведьмы и лешие, домовые и русалки, водяные и оборотни, а также другие персонажи древних славянских мифов, сказок, легенд, преданий, поверий и обычаев, услышанных писательницей в детстве, которое она провела в русской провинции. Рассказаны все эти истории с присущими Тэффи теплотой, душевностью, искренностью и юмором, а и без того выразительный язык, изысканность которого отмечали Бунин, Куприн и Мережковский, в «Ведьме» достигает своего пика.",духовное_возрождение,0
"Америка 1930-х годов глазами писателей-сатириков: Голливуд, Чикаго, Нью-Йорк, индейские резервации и провинциальные городки показаны через призму иронии и наблюдательности авторов.",культура,1
"Рассказы, вошедшие в этот сборник, объединены «главными темами» бунинской прозы — темами, к которым великий писатель возвращался на протяжении всей своей жизни. Русская деревня начала ХХ века, с ее нищетой и безнадежностью, — и далекие, экзотические страны, сожженные южным солнцем. Красота и поэтичность природы — и тайные, темные глубины человеческого разума и сердца. Ну и, конечно же, тема, в которой Бунину не было равных в отечественной литературе: любовь. Любовь драматичная, трагичная, которая для героев Бунина «крепка как смерть»…",литература,0
"Ф.М. Достоевский — мастер психологической прозы XIX века, признанный во всем мире. Его работы переведены более чем на 170 языков. «Преступление и наказание» — высочайший образец криминального романа. Достоевский поставил вопросы, и по сей день не решенные. Кем должен быть человек: «тварью дрожащей», как говорит Раскольников, или «Наполеоном»? Произведение написано в 1866 году, но до сих пор остается самой читаемой в мире книгой и входит в большинство школьных программ по литературе.",путешествие,0
"Роман, ставший своеобразным символом творчества Франца Кафки. Интересно, что Кафка не оставил никаких подсказок, по которым можно было бы как-то воссоздать фабулу романа. Главы не были пронумерованы и содержались в отдельных конвертах. Йозеф К. — рациональный герой среди абсурдного общества. Его ничем не примечательная, даже в чем-то банальная жизнь шла своим чередом, пока его не известили о том, что против него начат процесс... Абсурдность происходящего с К. пугает именно своей приземленной, холодной обыденностью, повседневностью и даже странной логичностью творящегося с героем ужаса, противостоять которому он не в силах. Где судья, которого он ни разу не видел? Где высокий суд, куда он так и не попал? Он виноват просто потому, что каждый человек в этой жизни может быть в чем-то виноват...",реализм,0
"«Дворянское гнездо» — поэтичная история несбывшейся любви, разбитых надежд и судьбы умного человека, совершившего трагическую ошибку и расплачивающегося за нее всю жизнь.",революция,0
"Преступление и наказание (1866) — одно из самых значительных произведений в истории мировой литературы. Это и глубокий философский роман, и тонкая психологическая драма, и захватывающий детектив, и величественная картина мрачного города, в недрах которого герои грешат и ищут прощения, жертвуют собой и отрекаются от себя ради ближних и находят успокоение в смирении, покаянии, вере. Главный герой романа Родион Раскольников решается на убийство, чтобы доказать себе и миру, что он не тварь дрожащая, а право имеет. Главным предметом исследования писателя становится процесс превращения добропорядочного, умного и доброго юноши в убийцу, а также то, как совершивший преступление Раскольников может искупить свою вину.",человек_и_природа,0
"Рассказы, вошедшие в этот сборник, объединены «главными темами» бунинской прозы — темами, к которым великий писатель возвращался на протяжении всей своей жизни. Русская деревня начала ХХ века, с ее нищетой и безнадежностью, — и далекие, экзотические страны, сожженные южным солнцем. Красота и поэтичность природы — и тайные, темные глубины человеческого разума и сердца. Ну и, конечно же, тема, в которой Бунину не было равных в отечественной литературе: любовь. Любовь драматичная, трагичная, которая для героев Бунина «крепка как смерть»…",антиутопия,0
"Князь Лев Николаевич Мышкин возвращается в Россию после пребывания в санатории и оказывается втянутым в сложный любовный треугольник. Его искренние порывы и чувства сталкиваются с жестоким миром ревности, самолюбия и пресыщенности окружающих. Такие насыщенные сюжеты всегда «обречены» вызывать в читателе автоматический эффект присутствия. Секрет не только и не столько в событийных перипетиях, сколько в великолепно выписанных персонажах и электрических разрядах между ними. Суммой всех слагаемых становится превращение эффекта присутствия в «эффект соучастия»: погружаясь в роман, вы становитесь сначала невидимым свидетелем событий, а потом сживаетесь с главным героем так прочно, что смотрите его глазами и меряете его мир биением собственного сердца. И тогда возникает главный вопрос: как выжить в этом мире, который казался вымышленным и вдруг стал таким реальным, и как здесь не сойти с ума. В конце концов, может ли общество определять степень чьей-то «нормальности»? Вообще, кто из нас князь Мышкин?",любовь_и_разочарование,0
"Свой третий роман Набоков начал писать на юге Франции, а закончил в 1929 году в Берлине, незадолго до этого написав матери: «Через три-четыре дня поставлю точку. Долго потом не буду браться за такие чудовищно трудные темы, а напишу что-нибудь тихое, плавное. Все же я доволен моим Лужиным, — но какая сложная, сложная махина». «Защита Лужина» содержит в себе множество пластов, каждый из которых подробно исследует одну из тем, которые впоследствии станут ключевыми в творчестве Набокова. Здесь и тема двойничества, и соприкосновение мира реального и вымышленного, и столкновение искусства с жизнью, гениальности с обыденностью. Для главного героя, подающего большие надежды гроссмейстера Лужина, одержимого шахматами, жизнь становится партией на шахматной доске, партией, в которой невозможно выиграть, но можно успешно защищаться. Безупречный набоковский стиль, захватывающий сюжет, тонкий психологизм мгновенно сделали из молодого автора одну из главных фигур русского зарубежья.",литература,0
"Истории, основанные на личном опыте Булгакова, — о внутренней борьбе и сострадании к ближнему, о чувстве долга и о надежде даже в самых отчаянных обстоятельствах. Молодого врача, только что окончившего университет, направляют работать в больницу в глуши. Там, один на один со сложными случаями, дремучестью пациентов и тяжелым каждодневным трудом, ему предстоит борьба с собственными страхами и сомнениями. \Записки юного врача — гимн (и одновременно реквием) земской медицине, где герой балансирует между подвижничеством и отчаянием.",гражданская_война,0
"Отцы и дети — знаменитый роман Тургенева, ставший чуть ли не самым значительным произведением в истории о взаимоотношениях поколений. Споры главного героя Евгения Базарова, называющего себя нигилистом и отрицающего расхожие представления о жизни, искусстве, морали, природе человека, и его антагониста Павла Кирсанова, аристократа до мозга костей, составляют главную проблематику романа. Но сюжетная канва строится скорее на внутреннем конфликте самого Базарова. Только что отрицавший все и вся герой, не веривший в любовь, смеявшийся над своим приятелем, способным на нежные чувства, вдруг сам страстно и пылко влюбляется. И все вдруг переворачивается вверх дном — с любовью Базаров совладать не в силах, она оказывается сильнее самых твердых убеждений.",социальная_несправедливость,0
"Удивительная, пронзительная и лиричная трилогия, в которую Лев Толстой вложил немало автобиографических мотивов. Перед читателем день за днем проходит жизнь Николеньки Иртенева, мальчика из аристократической русской семьи,– детские игры, отношения с друзьями, первая влюбленность, смерть матери, нелепые и смешные ошибки первых шагов «в свете», представляющиеся в юности судьбоносными и трагическими. Герой трилогии взрослеет буквально на наших глазах,– и мы невольно переживаем его радости и горести, победы и поражения, как свои собственные.",родители_и_дети,1
"Книга, которую не публиковали — ни отдельно, ни в составе собраний сочинений — в СССР даже после реабилитации Бунина. Самая жестокая, горькая, безжалостная и самая личная книга писателя. Книга, в которой он с беспощадной и язвительной иронией выносит приговор большевизму и советской власти, которую имел несчастье наблюдать сначала в Москве, а потом в Одессе, вплоть до эмиграции. Ни единого доброго слова не находит писатель для революции — кровавого, страшного хаоса, захлестнувшего Россию в 1917 году.",утопия,0
"\Война и мир — роман-эпопея Льва Толстого, одно из крупнейших произведений мировой литературы, описывающее жизнь русского общества в эпоху Наполеоновских войн. \Война и мир — это масштабная картина жизни России, взятая во всех ее социальных слоях (от крестьян до императора Александра I), и детальное описание хода военных действий, и осмысление поведения человека на войне, но главное — это глубокое философское осмысление и исследование жизни как таковой — в быту, в семье, в мирное время, на войне. Именно поэтому \Войну и мир\"" можно читать и перечитывать всю жизнь — этот роман никогда не потеряет своей актуальности.""",гражданская_война,0
Идея построения «общепролетарского дома» превращает «Котлован» в мощную антиутопию: утопический «земной рай» оборачивается кладбищем несбыточных фантазий и личной мировоззренческой трагедией.,первая_мировая_война,0
"Один из самых популярных романов Чингиза Айтматова. Главный герой — Едигей, стрелочник на железнодорожном разъезде Боранлы-Буранный. В суровых степях он живет рядом с лучшим другом Казангапом. После смерти друга Едигей решает похоронить его на старом кладбище Ана-Бейит — «Материнский упокой», овеянном легендами и преданиями. Однако на месте древнего кладбища уже построен обнесенный колючей проволокой космодром. Роман сложен по композиции: в нем переплетаются миф и реальность, настоящее и прошлое.",ревность,0
"«Бесы» (1871–1872 гг.) — наверное, самый пророческий роман Достоевского. Изначально задуманный как острополитическая вещь, основанная на впечатлениях писателя от «нечаевского процесса»: группу революционеров судили за убийство студента, решившего выйти из их кружка, — роман далеко перерос просто произведение на «злобу дня». На глазах у читателей разворачивается настоящая драма: в центре повествования — группа нигилистов во главе с Петром Верховенским, планирующая поднять смуту по всей России. У главного же героя романа Николая Ставрогина — своя тайна, свой страшный грех и своя большая беда — он совершенно опустошен, и жизнь уже не представляет для него никакого интереса. События в романе проносятся вихрем перед читателем, запутываются в какой-то чудовищный клубок и в результате разрешаются трагедией.",революция,1
"\Машенька (1926) — первый и во многом автобиографический роман, написанный Владимиром Набоковым в Берлине и посвященный русскому прошлому писателя. Молодой эмигрант Лев Ганин в немецком пансионе заново переживает историю своей первой любви, оборванную революцией. Сила творческой памяти позволяет ему преодолеть физическую разлуку с Машенькой (прототипом которой стала возлюбленная Набокова Валентина Шульгина), воссозданные его воображением картины дореволюционной России оказываются значительнее и ярче окружающих его декораций настоящего.",утопия,0
"Героя повести судят за убийство, совершенное по абсурдной причине, а идея абсолютной свободы становится его жизненным манифестом.",несчастная_любовь,0
