annotation,concept,label
"Иуда из Кариота – символ предательства, великий грешник, обрекший Иисуса Христа на смерть. При этом Иуда, пожалуй, самый загадочный евангельский персонаж – тем он и притягателен для Леонида Андреева с его интересом к противоречиям в человеческой душе. Повесть «Иуда Искариот», по словам самого автора, – «фантазия на тему о предательстве, добре и зле». Андреев пытается понять, что руководило поступками Иуды и почему он убивает себя. Писатель наполняет евангельский сюжет предательства психологическим содержанием, размышляя о любви и ненависти, страдании и жертвенности, случайном и неизбежном. В сборник также вошли роман «Дневник Сатаны», повести «Жизнь Василия Фивейского», «Рассказ о семи повешенных» и другие произведения разных периодов творчества Андреева.",героизм,0
"«История одного города» – язвительное, полное иронии произведение, в котором под видом «летописи» вымышленного города Глупова автор беспощадно обличает типичные пороки российского общества – глупость, самодурство и взяточничество власть имущих, казнокрадство и низкопоклонничество чиновников, лень, необразованность и мракобесие. К сожалению, приходится признать, что гомерически смешная и жестокая фантасмагория Салтыкова-Щедрина не утратила актуальности и в наши дни.",равнодушие,0
"Героя повести судят за убийство, совершенное по абсурдной причине, а идея абсолютной свободы становится его жизненным манифестом.",экзистенциальный_кризис,1
"«Бесы» (1871–1872 гг.) — наверное, самый пророческий роман Достоевского. Изначально задуманный как острополитическая вещь, основанная на впечатлениях писателя от «нечаевского процесса»: группу революционеров судили за убийство студента, решившего выйти из их кружка, — роман далеко перерос просто произведение на «злобу дня». На глазах у читателей разворачивается настоящая драма: в центре повествования — группа нигилистов во главе с Петром Верховенским, планирующая поднять смуту по всей России. У главного же героя романа Николая Ставрогина — своя тайна, свой страшный грех и своя большая беда — он совершенно опустошен, и жизнь уже не представляет для него никакого интереса. События в романе проносятся вихрем перед читателем, запутываются в какой-то чудовищный клубок и в результате разрешаются трагедией.",внутренний_конфликт,1
"Повесть «Записки из Мертвого дома» основана на воспоминаниях писателя о годах, проведенных в Омском остроге. По мнению критиков, именно с этого произведения начинается подлинный Достоевский с его психологизмом и глубиной образов. В «Записках из Мертвого дома» перед читателем открывается мир, где насилие над человеческой личностью принимает привычный, повседневный характер. Это история, повествующая о судьбах отверженных, которых Достоевский встречал на каторжных работах. Виновные и невинные, убийцы и контрабандисты, лихие воры и интеллигентные фальшивомонетчики, дворяне и крестьяне… Каждый обитатель острожного «Мертвого дома», созданный пером Достоевского, навеки остается в памяти.",миф,0
"Рассказы, вошедшие в этот сборник, объединены «главными темами» бунинской прозы — темами, к которым великий писатель возвращался на протяжении всей своей жизни. Русская деревня начала ХХ века, с ее нищетой и безнадежностью, — и далекие, экзотические страны, сожженные южным солнцем. Красота и поэтичность природы — и тайные, темные глубины человеческого разума и сердца. Ну и, конечно же, тема, в которой Бунину не было равных в отечественной литературе: любовь. Любовь драматичная, трагичная, которая для героев Бунина «крепка как смерть»…",несчастная_любовь,1
"В окружном суде слушается дело о похищении денег и отравлении купца Смелькова. Князь Дмитрий Нехлюдов, один из присяжных заседателей, узнает в обвиняемой проститутке Катюшу Маслову — милую девушку, которую он соблазнил и бросил в юности. Терзаемый муками совести, он решает помочь Катюше. Нехлюдов готов последовать за ней на каторгу в Сибирь и даже жениться, чтобы искупить свою вину. «Воскресение» — последний роман Льва Толстого, который затрагивает темы ответственности, вины и духовного воскресения души.",искупление,1
"Роман, ставший своеобразным символом творчества Франца Кафки. Интересно, что Кафка не оставил никаких подсказок, по которым можно было бы как-то воссоздать фабулу романа. Главы не были пронумерованы и содержались в отдельных конвертах. Йозеф К. — рациональный герой среди абсурдного общества. Его ничем не примечательная, даже в чем-то банальная жизнь шла своим чередом, пока его не известили о том, что против него начат процесс... Абсурдность происходящего с К. пугает именно своей приземленной, холодной обыденностью, повседневностью и даже странной логичностью творящегося с героем ужаса, противостоять которому он не в силах. Где судья, которого он ни разу не видел? Где высокий суд, куда он так и не попал? Он виноват просто потому, что каждый человек в этой жизни может быть в чем-то виноват...",лицемерие_личности,0
"\Война и мир — роман-эпопея Льва Толстого, одно из крупнейших произведений мировой литературы, описывающее жизнь русского общества в эпоху Наполеоновских войн. \Война и мир — это масштабная картина жизни России, взятая во всех ее социальных слоях (от крестьян до императора Александра I), и детальное описание хода военных действий, и осмысление поведения человека на войне, но главное — это глубокое философское осмысление и исследование жизни как таковой — в быту, в семье, в мирное время, на войне. Именно поэтому \Войну и мир\"" можно читать и перечитывать всю жизнь — этот роман никогда не потеряет своей актуальности.""",антиутопия,0
"Роман, ставший своеобразным символом творчества Франца Кафки. Интересно, что Кафка не оставил никаких подсказок, по которым можно было бы как-то воссоздать фабулу романа. Главы не были пронумерованы и содержались в отдельных конвертах. Йозеф К. — рациональный герой среди абсурдного общества. Его ничем не примечательная, даже в чем-то банальная жизнь шла своим чередом, пока его не известили о том, что против него начат процесс... Абсурдность происходящего с К. пугает именно своей приземленной, холодной обыденностью, повседневностью и даже странной логичностью творящегося с героем ужаса, противостоять которому он не в силах. Где судья, которого он ни разу не видел? Где высокий суд, куда он так и не попал? Он виноват просто потому, что каждый человек в этой жизни может быть в чем-то виноват...",ответственность_перед_законом,1
"Антиутопия о генетически программируемом обществе потребления, где трагическая судьба Дикаря раскрывает конфликт личности и системы.",миф,0
"Иуда из Кариота – символ предательства, великий грешник, обрекший Иисуса Христа на смерть. При этом Иуда, пожалуй, самый загадочный евангельский персонаж – тем он и притягателен для Леонида Андреева с его интересом к противоречиям в человеческой душе. Повесть «Иуда Искариот», по словам самого автора, – «фантазия на тему о предательстве, добре и зле». Андреев пытается понять, что руководило поступками Иуды и почему он убивает себя. Писатель наполняет евангельский сюжет предательства психологическим содержанием, размышляя о любви и ненависти, страдании и жертвенности, случайном и неизбежном. В сборник также вошли роман «Дневник Сатаны», повести «Жизнь Василия Фивейского», «Рассказ о семи повешенных» и другие произведения разных периодов творчества Андреева.",общественные_пороки,0
"В сборник, озаглавленный Гоголем \Миргород, вошли четыре повести, основанные на украинском фольклоре. \Старосветские помещики – печальная история любви двух супругов, любви, за границами которой герои уже не видят окружающего мира. \Тарас Бульба – ни в чем не схожая с предыдущей повесть о жизни запорожских казаков, где царят боевой дух, жажда воинской славы и любовь, которая оказывается сильнее долга перед родиной и перед отцом. Третья повесть – \Вий – леденящий душу рассказ о темных силах преисподней, в жуткой схватке с которыми, поддавшись страху, погибает семинарист. И, наконец, \Повесть о том, как поссорился Иван Иванович с Иваном Никифоровичем – юмористическая зарисовка из жизни городка Миргорода, кажется, никогда не стареющая история о том, как вдруг на ровном месте ссорятся закадычные друзья. Яркий пример того, как пустяковая размолвка может обернуться не просто враждой и судебным разбирательством, но чуть ли не смыслом всей жизни.",утопия,0
"Ф.М. Достоевский — мастер психологической прозы XIX века, признанный во всем мире. Его работы переведены более чем на 170 языков. «Преступление и наказание» — высочайший образец криминального романа. Достоевский поставил вопросы, и по сей день не решенные. Кем должен быть человек: «тварью дрожащей», как говорит Раскольников, или «Наполеоном»? Произведение написано в 1866 году, но до сих пор остается самой читаемой в мире книгой и входит в большинство школьных программ по литературе.",любовь,0
"\Война и мир — роман-эпопея Льва Толстого, одно из крупнейших произведений мировой литературы, описывающее жизнь русского общества в эпоху Наполеоновских войн. \Война и мир — это масштабная картина жизни России, взятая во всех ее социальных слоях (от крестьян до императора Александра I), и детальное описание хода военных действий, и осмысление поведения человека на войне, но главное — это глубокое философское осмысление и исследование жизни как таковой — в быту, в семье, в мирное время, на войне. Именно поэтому \Войну и мир\"" можно читать и перечитывать всю жизнь — этот роман никогда не потеряет своей актуальности.""",революция,0
"В окружном суде слушается дело о похищении денег и отравлении купца Смелькова. Князь Дмитрий Нехлюдов, один из присяжных заседателей, узнает в обвиняемой проститутке Катюшу Маслову — милую девушку, которую он соблазнил и бросил в юности. Терзаемый муками совести, он решает помочь Катюше. Нехлюдов готов последовать за ней на каторгу в Сибирь и даже жениться, чтобы искупить свою вину. «Воскресение» — последний роман Льва Толстого, который затрагивает темы ответственности, вины и духовного воскресения души.",суд,0
"Пять совсем еще юных девушек-зенитчиц под руководством старшины вступают в неравный бой с отрядом немецких диверсантов. Об этом великом, однако не попавшем в сводки военных событий подвиге повесть «А зори здесь тихие…» – шедевр русской «военной прозы», одно из самых проникновенных и трагических произведений о Великой Отечественной войне. Действие повести «Завтра была война» происходит накануне Великой Отечественной войны. Это история о школьниках, их взрослении, первом нравственном выборе и противостоянии, история о выпускниках, которым совсем скоро предстоит взять в руки оружие и отправиться на фронт – защищать Родину.",жертва,1
"Вошедшие в этот сборник «Ревизор» и «Женитьба» – две замечательные сатирические комедии Гоголя, два шедевра классической русской комедиографии, уже почти полтора столетия не сходящие с лучших сцен нашей страны и неоднократно экранизированные. Что же делает эти произведения актуальными? Не то ли, что типажи, так блестяще описанные Гоголем, – проворовавшиеся ленивые чиновники, провинциальные нувориши и их нелепо претендующие на столичный шик дочки, трусоватые женихи, никак не готовые расстаться с холостяцкой долей, и бойкие напористые свахи, – частенько встречаются нам и сейчас?",преступление,0
"«Дворянское гнездо» — поэтичная история несбывшейся любви, разбитых надежд и судьбы умного человека, совершившего трагическую ошибку и расплачивающегося за нее всю жизнь.",героизм,0
"Последний берлинский роман Набокова и грозное предупреждение не только современникам, но и потомкам. Роман создавался в Германии во второй половине тридцатых годов, когда страна медленно погружалась в пучину нацизма и уже готовилась утащить за собой весь мир. Судья шёпотом на ухо сообщает подсудимому Цинциннату Ц. его приговор – смертная казнь. С этого момента начинается череда совершенно безумных происшествий в совершенно безумном мире. Абсурдность всего происходящего поначалу вызывает улыбку, но постепенно, по мере развития действия, события принимают все более и более мрачный оборот. Несмотря на всю свою фантасмагоричность, этот мир действует по хоть и безумным, но невероятно жестким законам, которые нельзя обойти или отменить, а нарушение этих законов карается самым строгим образом. При этом главный герой виновен уже от рождения, виновен в том, что родился не таким прозрачным, как другие. Инаковость, непохожесть карается смертью.",внутренняя_свобода,1
Идея построения «общепролетарского дома» превращает «Котлован» в мощную антиутопию: утопический «земной рай» оборачивается кладбищем несбыточных фантазий и личной мировоззренческой трагедией.,миф,0
Душещипательная история о любви и трагической развязке.,революция,0
"Роман-исповедь о поиске нравственных ориентиров и конфликте поколений. 19-летний Аркадий Долгорукий стремится обрести через богатство свободу и власть, оказываясь втянутым в сложные семейные и любовные противоречия.",религия,0
"«Повести покойного Ивана Петровича Белкина» А.С. Пушкин написал болдинской осенью 1830 года, находясь на трехмесячном карантине. И, по собственному признанию, «он никогда еще так не писал» — «просто, коротко и ясно» и так плодотворно. По мнению самого поэта, нужно писать прозу, которая одновременно «требует мыслей и мыслей — без них блестящие выражения ни к чему не служат». Главный вопрос всех размышлений в «Повестях Белкина» был вопрос о счастье и судьбе. Абсолютно новаторский цикл позволил создать широкую картину русской жизни с высочайшей степенью человечности. Повесть «Дубровский» была задумана автором как роман эпохи пугачёвщины с героем-дворянином, перешедшим на сторону бунтовщиков. Работая над «Дубровским», Александр Пушкин задумал «Капитанскую дочку», а писал, когда работал над «Историей Пугачева». И Николай Гоголь назвал «Капитанскую дочку» «решительно лучшим русским произведеньем в повествовательном роде», в котором «выступили истинно русские характеры: простой комендант крепости, капитанша, поручик; сама крепость с единственной пушкой, бестолковщина времени и простое величие простых людей». В «Пиковой даме» А. Пушкин соединил признаки модных в то время повествований — светской и фантастической повестей и добился широкого признания. «Верхом искусства фантастического» позже назвал «Пиковую даму» Ф.М. Достоевский.",человечность,1
