annotation,concept,label
"Истории, основанные на личном опыте Булгакова, — о внутренней борьбе и сострадании к ближнему, о чувстве долга и о надежде даже в самых отчаянных обстоятельствах. Молодого врача, только что окончившего университет, направляют работать в больницу в глуши. Там, один на один со сложными случаями, дремучестью пациентов и тяжелым каждодневным трудом, ему предстоит борьба с собственными страхами и сомнениями. \Записки юного врача — гимн (и одновременно реквием) земской медицине, где герой балансирует между подвижничеством и отчаянием.",война,0
"Удивительная, пронзительная и лиричная трилогия, в которую Лев Толстой вложил немало автобиографических мотивов. Перед читателем день за днем проходит жизнь Николеньки Иртенева, мальчика из аристократической русской семьи,– детские игры, отношения с друзьями, первая влюбленность, смерть матери, нелепые и смешные ошибки первых шагов «в свете», представляющиеся в юности судьбоносными и трагическими. Герой трилогии взрослеет буквально на наших глазах,– и мы невольно переживаем его радости и горести, победы и поражения, как свои собственные.",жизненный_путь,0
"«Горе от ума» — одна из первых русских комедий, «разодранных» на пословицы и поговорки, которыми до сих пор украшена речь всякого мало-мальски начитанного человека. «Горе от ума» — комедия, давшая русской литературе первого «лишнего человека». Эта комедия с трагическим, в сущности, финалом — поистине «русская комедия» с отчетливым горьким осадком и бесконечным сочувствием герою. Издание снабжено комментарием, а также отрывками из статей А. С. Пушкина, И. А. Гончарова и А. Григорьева, посвященных комедии «Горе от ума», что, несомненно, поможет всем, кто изучает русскую словесность.",народная_судьба,0
"«Яма» — самое трагическое произведение Куприна, которое в свое время произвело среди читателей и критиков эффект разорвавшейся бомбы, и даже сейчас потрясает своей силой и беспощадным реализмом. Печальная история обитательниц борделя средней руки рассказана с почти фотографической точностью. Характеры «ночных бабочек», их клиентов и единственного друга — журналиста, образ которого у Куприна имеет автобиографические черты, восхищают психологической глубиной и яркостью. Роман захватывает не пикантностью темы, а честным, неравнодушным и человечным отношением автора к судьбе девушек, которых обстоятельства завели в «Яму».",первая_любовь,0
"\Машенька (1926) — первый и во многом автобиографический роман, написанный Владимиром Набоковым в Берлине и посвященный русскому прошлому писателя. Молодой эмигрант Лев Ганин в немецком пансионе заново переживает историю своей первой любви, оборванную революцией. Сила творческой памяти позволяет ему преодолеть физическую разлуку с Машенькой (прототипом которой стала возлюбленная Набокова Валентина Шульгина), воссозданные его воображением картины дореволюционной России оказываются значительнее и ярче окружающих его декораций настоящего.",идеология,0
"Знаковый роман, с которого официально отсчитывают само существование жанра \антиутопия Запрещенный в советский период, теперь он считается одним из классических произведений не только русской, но и мировой литературы ХХ века. Роман об \обществе равных, в котором человеческая личность сведена к \нумеру. В нем унифицировано все — одежда и квартиры, мысли и чувства. Нет ни семьи, ни прочных привязанностей Знаковый роман, с которого официально отсчитывают само существование жанра \антиутопия Запрещенный в советский период, теперь он считается одним из классических произведений не только русской, но и мировой литературы ХХ века. Роман об \обществе равных, в котором человеческая личность сведена к \нумеру. В нем унифицировано все — одежда и квартиры, мысли и чувства. Нет ни семьи, ни прочных привязанностей... Но можно ли вытравить из человека жажду свободы, пока он остается человеком? Но можно ли вытравить из человека жажду свободы, пока он остается человеком?",литература,0
"Александр Куприн — писатель, исследующий любовь в самых разных ее проявлениях. Так, повесть «Гранатовый браслет» рассказывает о чиновнике Желтковом, который, будучи одержим нежными чувствами к прекрасной, но недоступной княгине Вере Шеиной, дарит ей дорогое изящное украшение как символ своей любви. Современники восприняли произведение неоднозначно: одни видели в нем трогательную историю, другие — трагедию. Что значит любить и чем вы готовы пожертвовать ради своих чувств? Куприн мастерски передает атмосферу начала XX века и многослойность эмоций персонажей, создавая атмосферу глубокой тоски и нежности.",преступление,0
"Роман Константина Седых посвящен событиям последних лет Гражданской войны в Забайкалье: изгнанию интервентов, воссоединению Дальневосточной республики с Россией, возвращению партизан к мирной жизни. Старый мир исчезает в огне сражений, рождается новый порядок. В центре повествования — судьба семьи казаков Улыбиных и история подростка Ганьки, втянутого в партизанскую борьбу.",миф,0
"Пять совсем еще юных девушек-зенитчиц под руководством старшины вступают в неравный бой с отрядом немецких диверсантов. Об этом великом, однако не попавшем в сводки военных событий подвиге повесть «А зори здесь тихие…» – шедевр русской «военной прозы», одно из самых проникновенных и трагических произведений о Великой Отечественной войне. Действие повести «Завтра была война» происходит накануне Великой Отечественной войны. Это история о школьниках, их взрослении, первом нравственном выборе и противостоянии, история о выпускниках, которым совсем скоро предстоит взять в руки оружие и отправиться на фронт – защищать Родину.",армия,0
"Знаковый роман, с которого официально отсчитывают само существование жанра \антиутопия Запрещенный в советский период, теперь он считается одним из классических произведений не только русской, но и мировой литературы ХХ века. Роман об \обществе равных, в котором человеческая личность сведена к \нумеру. В нем унифицировано все — одежда и квартиры, мысли и чувства. Нет ни семьи, ни прочных привязанностей... Но можно ли вытравить из человека жажду свободы, пока он остается человеком?",богатство,0
"Ф.М. Достоевский — мастер психологической прозы XIX века, признанный во всем мире. Его работы переведены более than 170 языков. «Преступление и наказание» — высочайший образец криминального романа. Достоевский поставил вопросы, и по сей день не решенные. Кем должен быть человек: «тварью дрожащей», как говорит Раскольников, или «Наполеоном»? Произведение написано в 1866 году, но до сих пор остается самой читаемой в мире книгой и входит в большинство школьных программ по литературе.",тирания,0
"\Война и мир — роман-эпопея Льва Толстого, одно из крупнейших произведений мировой литературы, описывающее жизнь русского общества в эпоху Наполеоновских войн. \Война и мир — это масштабная картина жизни России, взятая во всех ее социальных слоях (от крестьян до императора Александра I), и детальное описание хода военных действий, и осмысление поведения человека на войне, но главное — это глубокое философское осмысление и исследование жизни как таковой — в быту, в семье, в мирное время, на войне. Именно поэтому \Войну и мир\"" можно читать и перечитывать всю жизнь — этот роман никогда не потеряет своей актуальности.""",человек_и_природа,0
"В этой книге вы прочтете новеллу «Судьба человека» и «Донские рассказы». «Судьба человека» (1956-1957 гг.) - пронзительный рассказ о временах Великой Отечественной войны. Одно из первых произведений советской литературы, в котором война показана правдиво и наглядно. Плен, немецкие концлагеря, побег, возвращение на фронт, потеря близких, тяжелое послевоенное время, попытка найти родную душу, спастись от одиночества. Рассказ экранизировал Сергей Бондарчук, он же и исполнил в нем главную роль - фильм начинающего режиссера получил главный приз Московского кинофестиваля в 1959 году. «Донские рассказы» (1924-1926 гг.) - это сборник из 6 рассказов, описывающих события Гражданской войны. Хотя местом действия остается Дон, с его особым колоритом и специфическим казачьим духом, очевидно, что события в этих новеллах могут быть спроецированы на всю Россию – война обнажает чувства, именно в такое кровавое время, когда стираются границы дозволенного, яснее становится, кто смог сохранить достоинство и остаться Человеком, а кто нет.",семья,0
"Роману «Игрок» присущи сильные автобиографические мотивы, ведь азартным игроком был сам Достоевский. История создания этой книги очень интересна: проигравшийся до последнего гроша в Висбадене, отчаянно нуждающийся в деньгах писатель заключил с издательством контракт, согласно которому должен был написать роман за 26 дней. Эти совершенно неправдоподобные сроки вынудили Достоевского впервые в жизни воспользоваться услугами секретаря-стенографистки, которой он надиктовывал текст. Так в жизнь гения вошла молодая Анна Сниткина — женщина, которой суждено было стать его женой и музой…",война,0
"Психологический роман о характере человека, внутреннем конфликте, разочаровании и выборе.",психологический_конфликт,0
"Тэффи считала сборник «Ведьма», вышедший в 1936 году, самой удачной своей книгой. На его страницах оживают ведьмы и лешие, домовые и русалки, водяные и оборотни, а также другие персонажи древних славянских мифов, сказок, легенд, преданий, поверий и обычаев, услышанных писательницей в детстве, которое она провела в русской провинции. Рассказаны все эти истории с присущими Тэффи теплотой, душевностью, искренностью и юмором, а и без того выразительный язык, изысканность которого отмечали Бунин, Куприн и Мережковский, в «Ведьме» достигает своего пика.",революция,0
"Психологический роман о характере человека, внутреннем конфликте, разочаровании и выборе.",несчастье,0
"\Анну Каренину по праву называют самым известным и популярным в мире романом о любви. \Огромная разработка души человеческой, как отзывался о книге Достоевский, — вот, наверное, что больше всего подкупает нас в этой книге. История всепоглощающей страсти, история замужней женщины, полюбившей красавца офицера и бросившей своего мужа наперекор всему: мнению света, общепринятой морали, своей совести. \Анну Каренину экранизировали 30 раз, музыку к балету писали Чайковский и Родион Щедрин, главную героиню в кино играли Грета Гарбо и Вивьен Ли, Алла Тарасова и Татьяна Самойлова, Софи Марсо и Кира Найтли. Эта книга, конечно, гораздо больше, чем просто роман о любви, это целая наука о семье, об обществе и о жизни.",несчастная_любовь,0
"Повесть «Раковый корпус» основана на личном опыте автора и изображает пациентов онкологического диспансера, в судьбах которых отражено состояние советского общества, пораженного беззаконием власти.",социальная_несправедливость,1
"Книга, которую не публиковали — ни отдельно, ни в составе собраний сочинений — в СССР даже после реабилитации Бунина. Самая жестокая, горькая, безжалостная и самая личная книга писателя. Книга, в которой он с беспощадной и язвительной иронией выносит приговор большевизму и советской власти, которую имел несчастье наблюдать сначала в Москве, а потом в Одессе, вплоть до эмиграции. Ни единого доброго слова не находит писатель для революции — кровавого, страшного хаоса, захлестнувшего Россию в 1917 году.",бунт_против_судьбы,0
"Книга, которую не публиковали — ни отдельно, ни в составе собраний сочинений — в СССР даже после реабилитации Бунина. Самая жестокая, горькая, безжалостная и самая личная книга писателя. Книга, в которой он с беспощадной и язвительной иронией выносит приговор большевизму и советской власти, которую имел несчастье наблюдать сначала в Москве, а потом в Одессе, вплоть до эмиграции. Ни единого доброго слова не находит писатель для революции — кровавого, страшного хаоса, захлестнувшего Россию в 1917 году.",первая_любовь,0
"«История одного города» – язвительное, полное иронии произведение, в котором под видом «летописи» вымышленного города Глупова автор беспощадно обличает типичные пороки российского общества – глупость, самодурство и взяточничество власть имущих, казнокрадство и низкопоклонничество чиновников, лень, необразованность и мракобесие. К сожалению, приходится признать, что гомерически смешная и жестокая фантасмагория Салтыкова-Щедрина не утратила актуальности и в наши дни.",жертва,0
"В книге Ивана Шмелева «Лето Господне» глазами ребенка изображен старый московский быт, раскрывается мир русского человека, жизнь которого проникнута православным духом и согрета христианской верой. Смысл и красота православных праздников и обрядов переданы как живая традиция, формирующая духовный облик человека.",детство,1
"«Тихий Дон» – масштабное эпическое полотно, повествующее о донском казачестве в самый противоречивый, переломный период истории нашей страны – кровавой Первой мировой и братоубийственной Гражданской войны, когда, по словам самого Шолохова, «в смертной драке брат идет на брата, сын – на отца». Что же происходило в душах людей в это смутное время, как получилось, что самые родные, близкие люди вдруг стали по разные стороны баррикад и превратились в смертельных врагов? По глубине осмысления действительности, удивительной точности в описании характеров этому произведению, пожалуй, нет равных. Книга, о которой говорят и спорят по сей день!",гражданская_война,1
"\Машенька (1926) — первый и во многом автобиографический роман, написанный Владимиром Набоковым в Берлине и посвященный русскому прошлому писателя. Молодой эмигрант Лев Ганин в немецком пансионе заново переживает историю своей первой любви, оборванную революцией. Сила творческой памяти позволяет ему преодолеть физическую разлуку с Машенькой (прототипом которой стала возлюбленная Набокова Валентина Шульгина), воссозданные его воображением картины дореволюционной России оказываются значительнее и ярче окружающих его декораций настоящего.",революционные_потрясения,0
"История города Макондо и рода Буэндиа, в котором чудеса повседневны, а судьба семьи становится отражением истории Латинской Америки.",фольклор,0
"История мальчиков, оказавшихся на необитаемом острове, превращается в философскую притчу о распаде цивилизации и природе человеческого зла.",насилие,1
